Site Code,Location*,Enforcement Start Date,Enforcement End Date,2020-07-01 00:00:00,2020-08-01 00:00:00,2020-09-01 00:00:00,2020-10-01 00:00:00,2020-11-01 00:00:00,2020-12-01 00:00:00,2021-01-01 00:00:00,2021-02-01 00:00:00,2021-03-01 00:00:00,2021-04-01 00:00:00,2021-05-01 00:00:00,2021-06-01 00:00:00,2021-07-01 00:00:00,2021-08-01 00:00:00,2021-09-01 00:00:00,2021-10-01 00:00:00,2021-11-01 00:00:00,2021-12-01 00:00:00,2022-01-01 00:00:00,2022-02-01 00:00:00,2022-03-01 00:00:00,2022-04-01 00:00:00,2022-05-01 00:00:00,2022-06-01 00:00:00,2022-07-01 00:00:00,2022-08-01 00:00:00,2022-09-01 00:00:00,2022-10-01 00:00:00,2022-11-01 00:00:00,2022-12-01 00:00:00
A001,Royalcrest Rd. Near Cabernet Circle,2020-07-06,2020-11-11 00:00:00,1117,479,487,354,39,-,-,-,-,-,-,-,-,-,-,-,-,-,-,-,-,-,-,-,-,-,-,-,-,-
A002,Harefield Dr. Near Barford Rd.,2020-07-06,2020-10-25 00:00:00,43,21,10,16,-,-,-,-,-,-,-,-,-,-,-,-,-,-,-,-,-,-,-,-,-,-,-,-,-,-
A003,Renforth Dr. Near Lafferty St.,2020-07-06,2020-10-25 00:00:00,2428,1665,1037,268,-,-,-,-,-,-,-,-,-,-,-,-,-,-,-,-,-,-,-,-,-,-,-,-,-,-
A004,Trehorne Dr. Near Duffield Rd.,2020-07-06,2020-10-25 00:00:00,837,415,239,168,-,-,-,-,-,-,-,-,-,-,-,-,-,-,-,-,-,-,-,-,-,-,-,-,-,-
A005,Horner Ave. Near Orianna Dr.,2020-07-06,2020-10-25 00:00:00,665,350,96,247,-,-,-,-,-,-,-,-,-,-,-,-,-,-,-,-,-,-,-,-,-,-,-,-,-,-
A006,Chartwell Rd. South of Larstone Ave.,2020-07-06,2020-10-25 00:00:00,17,3,6,20,-,-,-,-,-,-,-,-,-,-,-,-,-,-,-,-,-,-,-,-,-,-,-,-,-,-
A007,Jameson Ave. South of Laxton Ave.,2020-07-06,2020-12-12 00:00:00,400,524,524,443,39,-,-,-,-,-,-,-,-,-,-,-,-,-,-,-,-,-,-,-,-,-,-,-,-,-
A008,Close Ave. South of Queen St. W.,2020-07-06,2020-10-25 00:00:00,37,64,35,31,-,-,-,-,-,-,-,-,-,-,-,-,-,-,-,-,-,-,-,-,-,-,-,-,-,-
A009,Bicknell Ave. South of Avon Dr.,2020-07-06,2020-10-25 00:00:00,1665,1164,545,636,-,-,-,-,-,-,-,-,-,-,-,-,-,-,-,-,-,-,-,-,-,-,-,-,-,-
A010,Brookhaven Dr. North of Nordale Cres.,2020-07-06,2020-10-25 00:00:00,331,301,149,143,-,-,-,-,-,-,-,-,-,-,-,-,-,-,-,-,-,-,-,-,-,-,-,-,-,-
A011,Faywood Blvd. Near Laurelcrest Ave.,2020-07-06,2020-10-25 00:00:00,299,271,67,189,-,-,-,-,-,-,-,-,-,-,-,-,-,-,-,-,-,-,-,-,-,-,-,-,-,-
A012,Wilmington Ave. North of Purdon Dr.,2020-07-06,2020-10-25 00:00:00,1242,1025,253,400,-,-,-,-,-,-,-,-,-,-,-,-,-,-,-,-,-,-,-,-,-,-,-,-,-,-
A013,Derrydown Rd. North of Catford Rd.,2020-07-06,2020-10-25 00:00:00,1,10,16,9,-,-,-,-,-,-,-,-,-,-,-,-,-,-,-,-,-,-,-,-,-,-,-,-,-,-
A014,Grandravine Dr. East of Jane St.,2020-07-06,2020-11-11 00:00:00,231,146,112,71,44,-,-,-,-,-,-,-,-,-,-,-,-,-,-,-,-,-,-,-,-,-,-,-,-,-
A015,Corona St. South of Claver Ave.,2020-07-06,2020-11-11 00:00:00,315,120,83,64,40,-,-,-,-,-,-,-,-,-,-,-,-,-,-,-,-,-,-,-,-,-,-,-,-,-
A016,Ridge Hill Dr. West of Old Park Rd.,2020-07-06,2020-11-24 00:00:00,578,344,242,159,146,-,-,-,-,-,-,-,-,-,-,-,-,-,-,-,-,-,-,-,-,-,-,-,-,-
A017,Caledonia Rd. North of Rogers Rd.,2020-07-06,2020-10-25 00:00:00,1653,1468,511,628,-,-,-,-,-,-,-,-,-,-,-,-,-,-,-,-,-,-,-,-,-,-,-,-,-,-
A018,Gladstone Ave. South of Cross St.,2020-07-06,2020-10-25 00:00:00,235,468,343,225,-,-,-,-,-,-,-,-,-,-,-,-,-,-,-,-,-,-,-,-,-,-,-,-,-,-
A019,Manning Ave. North of Robinson St.,2020-07-06,2020-10-25 00:00:00,23,19,11,13,-,-,-,-,-,-,-,-,-,-,-,-,-,-,-,-,-,-,-,-,-,-,-,-,-,-
A020,Givins St. South of Argyle St.,2020-07-06,2020-10-25 00:00:00,15,45,26,13,-,-,-,-,-,-,-,-,-,-,-,-,-,-,-,-,-,-,-,-,-,-,-,-,-,-
A021,Lippincott St. South of Vankoughnet St. ,2020-07-06,2020-10-25 00:00:00,24,48,34,29,-,-,-,-,-,-,-,-,-,-,-,-,-,-,-,-,-,-,-,-,-,-,-,-,-,-
A022,Huron St. South of Bernard Ave.,2020-07-06,2020-10-25 00:00:00,168,213,133,141,-,-,-,-,-,-,-,-,-,-,-,-,-,-,-,-,-,-,-,-,-,-,-,-,-,-
A023,Atlas Ave. South of Ava Rd.,2020-07-06,2020-10-25 00:00:00,39,31,28,17,-,-,-,-,-,-,-,-,-,-,-,-,-,-,-,-,-,-,-,-,-,-,-,-,-,-
A024,Brownlow Ave. South of Eglinton Ave. E.,2020-07-06,2020-10-25 00:00:00,140,113,88,72,-,-,-,-,-,-,-,-,-,-,-,-,-,-,-,-,-,-,-,-,-,-,-,-,-,-
A025,Prospect St. East of Ontario St.,2020-07-06,2020-10-25 00:00:00,3,3,3,1,-,-,-,-,-,-,-,-,-,-,-,-,-,-,-,-,-,-,-,-,-,-,-,-,-,-
A026,Spruce St. Near Gifford St. ,2020-07-06,2020-10-25 00:00:00,0,3,8,2,-,-,-,-,-,-,-,-,-,-,-,-,-,-,-,-,-,-,-,-,-,-,-,-,-,-
A027,Chatham Ave. East of Jones Ave.,2020-07-06,2020-10-25 00:00:00,670,443,340,180,-,-,-,-,-,-,-,-,-,-,-,-,-,-,-,-,-,-,-,-,-,-,-,-,-,-
A028,Morse St. South of Queen St. E.,2020-07-06,2020-10-25 00:00:00,28,15,21,54,-,-,-,-,-,-,-,-,-,-,-,-,-,-,-,-,-,-,-,-,-,-,-,-,-,-
A029,Bessborough Dr. North of Field Ave. ,2020-07-06,2020-10-25 00:00:00,233,272,184,127,-,-,-,-,-,-,-,-,-,-,-,-,-,-,-,-,-,-,-,-,-,-,-,-,-,-
A030,Ranleigh Ave. East of Yonge St.,2020-07-06,2020-10-25 00:00:00,241,382,146,75,-,-,-,-,-,-,-,-,-,-,-,-,-,-,-,-,-,-,-,-,-,-,-,-,-,-
A031,Gateway Blvd. Near 10 Gateway Blvd.,2020-07-06,2020-10-25 00:00:00,721,1123,964,465,-,-,-,-,-,-,-,-,-,-,-,-,-,-,-,-,-,-,-,-,-,-,-,-,-,-
A032,Ness Dr. North of York Mills Rd.,2020-07-06,2020-10-25 00:00:00,7,13,7,5,-,-,-,-,-,-,-,-,-,-,-,-,-,-,-,-,-,-,-,-,-,-,-,-,-,-
A033,Elkhorn Dr. West of Red Maple Court,2020-07-06,2020-10-25 00:00:00,4,118,89,72,-,-,-,-,-,-,-,-,-,-,-,-,-,-,-,-,-,-,-,-,-,-,-,-,-,-
A034,Cherokee Blvd. South of Pinto Dr.,2020-07-06,2020-10-25 00:00:00,154,230,164,87,-,-,-,-,-,-,-,-,-,-,-,-,-,-,-,-,-,-,-,-,-,-,-,-,-,-
A035,Patricia Ave. West of Homewood Ave.,2020-07-06,2020-10-25 00:00:00,273,298,236,133,-,-,-,-,-,-,-,-,-,-,-,-,-,-,-,-,-,-,-,-,-,-,-,-,-,-
A036,Lillian St. South of Abitibi Ave.,2020-07-06,2020-10-25 00:00:00,251,251,145,109,-,-,-,-,-,-,-,-,-,-,-,-,-,-,-,-,-,-,-,-,-,-,-,-,-,-
A037,Main St. South of Swanwick Ave.,2020-07-06,2020-11-11 00:00:00,412,487,231,143,6,-,-,-,-,-,-,-,-,-,-,-,-,-,-,-,-,-,-,-,-,-,-,-,-,-
A038,Barrington Ave. North of Secord Ave.,2020-07-06,2020-10-25 00:00:00,553,477,324,191,-,-,-,-,-,-,-,-,-,-,-,-,-,-,-,-,-,-,-,-,-,-,-,-,-,-
A039,Falmouth Ave. South of Brussels Rd.,2020-07-06,2020-10-25 00:00:00,86,151,88,37,-,-,-,-,-,-,-,-,-,-,-,-,-,-,-,-,-,-,-,-,-,-,-,-,-,-
A040,Birchmount Rd. North of Kingston Rd.,2020-07-06,2020-10-25 00:00:00,759,854,661,212,-,-,-,-,-,-,-,-,-,-,-,-,-,-,-,-,-,-,-,-,-,-,-,-,-,-
A041,Brimorton Dr. East of Hathway Dr.,2020-07-06,2020-10-25 00:00:00,499,487,366,204,-,-,-,-,-,-,-,-,-,-,-,-,-,-,-,-,-,-,-,-,-,-,-,-,-,-
A042,Marcos Blvd. Near Cicerella Cres.,2020-07-06,2020-10-25 00:00:00,4,7,9,7,-,-,-,-,-,-,-,-,-,-,-,-,-,-,-,-,-,-,-,-,-,-,-,-,-,-
A043,Beverly Glen Blvd. West of Stonebridge Blvd.,2020-07-06,2020-11-04 00:00:00,6,7,11,7,-,-,-,-,-,-,-,-,-,-,-,-,-,-,-,-,-,-,-,-,-,-,-,-,-,-
A044,Silver Springs Blvd. Near Revlis Cres.,2020-07-06,2020-10-25 00:00:00,355,47,51,32,-,-,-,-,-,-,-,-,-,-,-,-,-,-,-,-,-,-,-,-,-,-,-,-,-,-
A045,Crow Trail Near Bradstone Square,2020-07-06,2020-10-25 00:00:00,163,126,88,32,-,-,-,-,-,-,-,-,-,-,-,-,-,-,-,-,-,-,-,-,-,-,-,-,-,-
A046,Alton Towers Circle Near 295 Alton Towers Circle,2020-07-06,2020-10-25 00:00:00,65,122,103,42,-,-,-,-,-,-,-,-,-,-,-,-,-,-,-,-,-,-,-,-,-,-,-,-,-,-
A047,Galloway Rd. North of Lawrence Ave. E.,2020-07-06,2020-10-25 00:00:00,1,3,22,9,-,-,-,-,-,-,-,-,-,-,-,-,-,-,-,-,-,-,-,-,-,-,-,-,-,-
A048,Military Trail East of Cindy Nicholas Dr.,2020-07-06,2020-10-25 00:00:00,647,544,497,299,-,-,-,-,-,-,-,-,-,-,-,-,-,-,-,-,-,-,-,-,-,-,-,-,-,-
A049,Hupfield Trail Near Glanvil Cres.,2020-07-06,2020-10-25 00:00:00,118,169,128,40,-,-,-,-,-,-,-,-,-,-,-,-,-,-,-,-,-,-,-,-,-,-,-,-,-,-
A050,Murison Blvd. Near Curtis Cres.,2020-07-06,2020-10-25 00:00:00,48,153,71,32,-,-,-,-,-,-,-,-,-,-,-,-,-,-,-,-,-,-,-,-,-,-,-,-,-,-
A051,Golfdown Dr. East of Turpin Ave.,2020-11-25,2021-05-10 00:00:00,-,-,-,-,11,340,283,178,155,235,94,-,-,-,-,-,-,-,-,-,-,-,-,-,-,-,-,-,-,-
A052,Mount Olive Dr. West of Kipling Ave.,2020-12-03,2021-05-10 00:00:00,-,-,-,-,-,588,427,60,104,84,25,-,-,-,-,-,-,-,-,-,-,-,-,-,-,-,-,-,-,-
A053,The Kingsway South of Hartfield Rd.,2020-11-09,2021-05-06 00:00:00,-,-,-,-,883,445,701,516,611,578,194,-,-,-,-,-,-,-,-,-,-,-,-,-,-,-,-,-,-,-
A054,Mill Rd. North of Bloor St. W.,2020-11-09,2021-05-10 00:00:00,-,-,-,-,334,424,280,310,261,340,32,-,-,-,-,-,-,-,-,-,-,-,-,-,-,-,-,-,-,-
A055,Mimico Ave. West of Station Rd.,2020-11-18,2021-05-06 00:00:00,-,-,-,-,316,408,595,603,487,671,157,-,-,-,-,-,-,-,-,-,-,-,-,-,-,-,-,-,-,-
A056,Stanley Ave. Near Elizabeth St.,2020-12-03,2021-05-06 00:00:00,-,-,-,-,-,2888,621,210,278,323,53,-,-,-,-,-,-,-,-,-,-,-,-,-,-,-,-,-,-,-
A057,Willard Ave. Near Rexford Rd.,2020-12-22,2021-05-06 00:00:00,-,-,-,-,-,6,11,10,20,21,1,-,-,-,-,-,-,-,-,-,-,-,-,-,-,-,-,-,-,-
A058,Mountview Ave. Near 51 Mountview Ave.,2020-11-19,2021-05-11 00:00:00,-,-,-,-,-,1,2,1,3,1,4,-,-,-,-,-,-,-,-,-,-,-,-,-,-,-,-,-,-,-
A059,Rockcliffe Blvd. Near Rockcliffe Court,2020-11-09,2021-05-06 00:00:00,-,-,-,-,801,1316,871,1235,1264,528,287,-,-,-,-,-,-,-,-,-,-,-,-,-,-,-,-,-,-,-
A060,Jane St. North of Lambton Ave.,2020-11-09,2021-05-11 00:00:00,-,-,-,-,1675,1198,1519,1331,2345,1510,757,-,-,-,-,-,-,-,-,-,-,-,-,-,-,-,-,-,-,-
A061,Ancaster Rd. Near Plewes Rd.,2020-11-09,2021-05-10 00:00:00,-,-,-,-,6,7,16,18,62,35,18,-,-,-,-,-,-,-,-,-,-,-,-,-,-,-,-,-,-,-
A062,Dovehouse Ave. West of Keele St.,2020-11-09,2021-05-10 00:00:00,-,-,-,-,123,74,108,82,125,184,57,-,-,-,-,-,-,-,-,-,-,-,-,-,-,-,-,-,-,-
A063,Topcliff Ave. Near 96 Topcliff Ave.,2020-11-25,2021-05-10 00:00:00,-,-,-,-,62,125,70,32,225,156,50,-,-,-,-,-,-,-,-,-,-,-,-,-,-,-,-,-,-,-
A064,Gracedale Blvd. Near Crimscott Rd.,2020-11-09,2021-05-10 00:00:00,-,-,-,-,15,17,9,10,55,33,7,-,-,-,-,-,-,-,-,-,-,-,-,-,-,-,-,-,-,-
A065,Avenue Rd. Near Castlefield Ave.,2020-12-03,2021-05-11 00:00:00,-,-,-,-,-,875,1255,1023,1224,647,649,-,-,-,-,-,-,-,-,-,-,-,-,-,-,-,-,-,-,-
A066,Bedford Park Ave. West of Yonge St.,2020-12-03,2021-05-03 00:00:00,-,-,-,-,-,7,13,17,35,19,2,-,-,-,-,-,-,-,-,-,-,-,-,-,-,-,-,-,-,-
A067,Laughton Ave. Near Talbot St.,2020-11-09,2021-05-26 00:00:00,-,-,-,-,1,5,2,2,18,9,8,-,-,-,-,-,-,-,-,-,-,-,-,-,-,-,-,-,-,-
A068,Ruskin Ave. West of Perth Ave.,2020-11-10,2021-05-10 00:00:00,-,-,-,-,77,10,6,8,49,57,26,-,-,-,-,-,-,-,-,-,-,-,-,-,-,-,-,-,-,-
A069,Denison Ave. South of Grange Ave.,2020-11-09,2021-05-10 00:00:00,-,-,-,-,412,351,217,187,254,166,127,-,-,-,-,-,-,-,-,-,-,-,-,-,-,-,-,-,-,-
A070,Brant St. South of Adelaide St. W.,2020-11-11,2021-05-05 00:00:00,-,-,-,-,140,138,67,74,275,205,47,-,-,-,-,-,-,-,-,-,-,-,-,-,-,-,-,-,-,-
A071,Orde St. West of Murray St.,2020-12-14,2021-05-26 00:00:00,-,-,-,-,-,14,25,16,16,17,10,-,-,-,-,-,-,-,-,-,-,-,-,-,-,-,-,-,-,-
A072,Essex St. West of Christie St.,2020-11-16,2021-05-11 00:00:00,-,-,-,-,48,98,57,15,121,102,44,-,-,-,-,-,-,-,-,-,-,-,-,-,-,-,-,-,-,-
A073,Ava Rd. East of Westover Hill Rd.,2020-11-11,2021-05-12 00:00:00,-,-,-,-,199,275,184,44,380,338,157,-,-,-,-,-,-,-,-,-,-,-,-,-,-,-,-,-,-,-
A074,Tweedsmuir Ave. South of Heath St. W.,2020-11-17,2021-05-10 00:00:00,-,-,-,-,38,119,82,34,189,162,47,-,-,-,-,-,-,-,-,-,-,-,-,-,-,-,-,-,-,-
A075,Sherbourne St. South of Wellesley St. E.,2020-11-16,2021-05-11 00:00:00,-,-,-,-,228,600,460,355,431,341,167,-,-,-,-,-,-,-,-,-,-,-,-,-,-,-,-,-,-,-
A076,Berkeley St. South of Gerrard St. E.,2020-11-25,2021-05-31 00:00:00,-,-,-,-,-,2,2,7,14,5,16,-,-,-,-,-,-,-,-,-,-,-,-,-,-,-,-,-,-,-
A077,Dundas St. E. East of Broadview Ave.,2020-11-09,2021-05-06 00:00:00,-,-,-,-,242,242,219,153,304,310,50,-,-,-,-,-,-,-,-,-,-,-,-,-,-,-,-,-,-,-
A078,Lesmount Ave. South of Cosburn Ave.,2020-11-09,2021-05-06 00:00:00,-,-,-,-,50,66,34,14,106,110,17,-,-,-,-,-,-,-,-,-,-,-,-,-,-,-,-,-,-,-
A079,Erskine Ave. West of Redpath Ave.,2020-11-09,2021-05-03 00:00:00,-,-,-,-,438,660,468,119,569,500,0,-,-,-,-,-,-,-,-,-,-,-,-,-,-,-,-,-,-,-
A080,Thorncliffe Park Dr. Near 79 Thorncliffe Park Dr.,2020-11-20,2021-05-03 00:00:00,-,-,-,-,36,153,111,80,201,219,28,-,-,-,-,-,-,-,-,-,-,-,-,-,-,-,-,-,-,-
A081,Fenside Dr. South of Roywood Dr.,2020-11-16,2021-05-03 00:00:00,-,-,-,-,3,47,30,35,125,82,1,-,-,-,-,-,-,-,-,-,-,-,-,-,-,-,-,-,-,-
A082,Underhill Dr. Near Bevridge Dr.,2020-11-09,2021-05-03 00:00:00,-,-,-,-,267,462,676,438,410,418,30,-,-,-,-,-,-,-,-,-,-,-,-,-,-,-,-,-,-,-
A083,Sheppard Ave. E. West of Don Mills Rd.,2020-12-10,2021-05-03 00:00:00,-,-,-,-,-,1114,6603,4618,5247,3706,-,-,-,-,-,-,-,-,-,-,-,-,-,-,-,-,-,-,-,-
A084,Seneca Hill Dr. West of Don Mills Rd.,2020-12-03,2021-05-25 00:00:00,-,-,-,-,-,255,185,48,148,98,121,-,-,-,-,-,-,-,-,-,-,-,-,-,-,-,-,-,-,-
A085,Doris Ave. North of Spring Garden Ave.,2020-11-11,2021-05-04 00:00:00,-,-,-,-,485,48,694,1166,3096,2798,268,-,-,-,-,-,-,-,-,-,-,-,-,-,-,-,-,-,-,-
A086,Church Ave. East of Doris Ave.,2020-11-11,2021-05-04 00:00:00,-,-,-,-,177,337,247,106,163,150,24,-,-,-,-,-,-,-,-,-,-,-,-,-,-,-,-,-,-,-
A087,Kingston Rd. Near Heyworth Cres.,2020-11-16,2021-05-03 00:00:00,-,-,-,-,1264,673,1749,987,1543,1050,57,-,-,-,-,-,-,-,-,-,-,-,-,-,-,-,-,-,-,-
A088,Spruce Hill Rd. North of Queen St. E.,2020-11-25,2021-05-03 00:00:00,-,-,-,-,1,33,46,58,169,107,4,-,-,-,-,-,-,-,-,-,-,-,-,-,-,-,-,-,-,-
A089,Edge Park Ave. East of Victoria Park Ave.,2020-11-17,2021-05-03 00:00:00,-,-,-,-,13,137,86,52,77,138,12,-,-,-,-,-,-,-,-,-,-,-,-,-,-,-,-,-,-,-
A090,Birchcliff Ave. Near Freeman St.,2020-11-18,2021-05-03 00:00:00,-,-,-,-,-,8,6,4,22,16,2,-,-,-,-,-,-,-,-,-,-,-,-,-,-,-,-,-,-,-
A091,Ellesmere Rd. East of Mondeo Dr.,2020-11-18,2021-05-06 00:00:00,-,-,-,-,1477,1643,1538,1839,1964,1404,276,-,-,-,-,-,-,-,-,-,-,-,-,-,-,-,-,-,-,-
A092,Gooderham Dr. South of Murray Glen Dr.,2020-12-02,2021-05-04 00:00:00,-,-,-,-,-,44,24,34,69,40,7,-,-,-,-,-,-,-,-,-,-,-,-,-,-,-,-,-,-,-
A093,Birchmount Rd. South of Huntingwood Dr.,2020-11-25,2021-05-04 00:00:00,-,-,-,-,785,1837,1932,1332,1379,898,222,-,-,-,-,-,-,-,-,-,-,-,-,-,-,-,-,-,-,-
A094,Southlawn Dr. Near Buena Vista Ave.,2020-11-18,2021-05-04 00:00:00,-,-,-,-,-,3,10,8,32,17,4,-,-,-,-,-,-,-,-,-,-,-,-,-,-,-,-,-,-,-
A095,McCowan Rd. North of Kenhatch Blvd.,2020-12-03,2021-05-04 00:00:00,-,-,-,-,-,1762,3236,3530,3264,2116,-,-,-,-,-,-,-,-,-,-,-,-,-,-,-,-,-,-,-,-
A096,Brimwood Blvd. Near Bridley Dr.,2020-12-07,2021-05-04 00:00:00,-,-,-,-,-,56,54,107,237,113,11,-,-,-,-,-,-,-,-,-,-,-,-,-,-,-,-,-,-,-
A097,Scarborough Golf Club Rd. North of Lawrence Ave. E.,2020-12-10,2021-05-28 00:00:00,-,-,-,-,-,1626,2101,1394,1737,1040,2328,-,-,-,-,-,-,-,-,-,-,-,-,-,-,-,-,-,-,-
A098,Holmfirth Terrace West of Vanwart Dr.,2020-11-19,2021-05-11 00:00:00,-,-,-,-,99,326,185,184,289,222,39,-,-,-,-,-,-,-,-,-,-,-,-,-,-,-,-,-,-,-
A099,Charlottetown Blvd. Near McCulley St.,2020-11-19,2021-05-04 00:00:00,-,-,-,-,38,187,68,93,154,235,27,-,-,-,-,-,-,-,-,-,-,-,-,-,-,-,-,-,-,-
A100,Durnford Rd. North of Rylander Blvd.,2020-12-02,2021-05-04 00:00:00,-,-,-,-,-,142,46,83,160,81,-,-,-,-,-,-,-,-,-,-,-,-,-,-,-,-,-,-,-,-
A101,Martin Grove Rd. North of Garfella Dr.,2021-06-08,2021-10-19 00:00:00,-,-,-,-,-,-,-,-,-,-,-,2341,1152,677,1337,993,-,-,-,-,-,-,-,-,-,-,-,-,-,-
A102,John Garland Blvd. Near Kendleton Dr.,2021-06-09,2021-10-19 00:00:00,-,-,-,-,-,-,-,-,-,-,-,1379,167,317,300,200,-,-,-,-,-,-,-,-,-,-,-,-,-,-
A103,The East Mall South of Capri Rd,2021-07-14,2021-10-19 00:00:00,-,-,-,-,-,-,-,-,-,-,-,-,253,84,1277,345,-,-,-,-,-,-,-,-,-,-,-,-,-,-
A104,La Rose Ave. East of Griggsden Ave.,2021-05-27,2021-10-18 00:00:00,-,-,-,-,-,-,-,-,-,-,-,250,133,52,243,146,-,-,-,-,-,-,-,-,-,-,-,-,-,-
A105,Algoma St. East of Royal York Rd.,2021-06-08,2021-10-27 00:00:00,-,-,-,-,-,-,-,-,-,-,-,180,237,165,126,159,-,-,-,-,-,-,-,-,-,-,-,-,-,-
A106,Lake Shore Blvd. W. Near Twentieth St.,2021-08-18,2021-10-27 00:00:00,-,-,-,-,-,-,-,-,-,-,-,-,-,16,18,101,-,-,-,-,-,-,-,-,-,-,-,-,-,-
A107,Windermere Ave. Near St. Olaves Rd.,2021-06-01,2021-10-20 00:00:00,-,-,-,-,-,-,-,-,-,-,-,2689,-,202,794,602,-,-,-,-,-,-,-,-,-,-,-,-,-,-
A108,Annette St. Near Laws St.,2021-06-18,2021-10-18 00:00:00,-,-,-,-,-,-,-,-,-,-,-,70,153,324,88,97,-,-,-,-,-,-,-,-,-,-,-,-,-,-
A109,Guestville Ave. Near Dennis Ave.,2021-06-02,2021-10-18 00:00:00,-,-,-,-,-,-,-,-,-,-,-,332,120,74,88,147,-,-,-,-,-,-,-,-,-,-,-,-,-,-
A110,Culford Rd. North of Burr Ave.,2021-06-14,2021-11-16 00:00:00,-,-,-,-,-,-,-,-,-,-,-,453,160,207,404,204,-,-,-,-,-,-,-,-,-,-,-,-,-,-
A111,Wilson Ave. Near 1196 Wilson Ave.,2021-06-08,2021-10-21 00:00:00,-,-,-,-,-,-,-,-,-,-,-,3356,2125,1436,1729,901,-,-,-,-,-,-,-,-,-,-,-,-,-,-
A112,Northover St. South of Sheppard Ave. W.,2021-05-29,2021-10-21 00:00:00,-,-,-,-,-,-,-,-,-,-,-,137,100,112,115,45,-,-,-,-,-,-,-,-,-,-,-,-,-,-
A113,Shoreham Dr. West of Gosford Blvd.,2021-06-09,2021-10-26 00:00:00,-,-,-,-,-,-,-,-,-,-,-,374,182,187,142,86,-,-,-,-,-,-,-,-,-,-,-,-,-,-
A114,Stong Court West of Driftwood Ave.,2021-06-02,2021-10-29 00:00:00,-,-,-,-,-,-,-,-,-,-,-,21,33,21,18,20,-,-,-,-,-,-,-,-,-,-,-,-,-,-
A115,Wilson Ave. West of Belgrave Ave.,2021-07-15,2021-10-19 00:00:00,-,-,-,-,-,-,-,-,-,-,-,-,110,258,507,245,-,-,-,-,-,-,-,-,-,-,-,-,-,-
A116,Marlee Ave. South of Hillmount Ave,2021-06-11,2021-10-20 00:00:00,-,-,-,-,-,-,-,-,-,-,-,690,146,195,561,657,-,-,-,-,-,-,-,-,-,-,-,-,-,-
A117,Dufferin St. Near Waterloo Ave.,2021-07-28,2021-10-27 00:00:00,-,-,-,-,-,-,-,-,-,-,-,-,-,250,306,554,-,-,-,-,-,-,-,-,-,-,-,-,-,-
A118,Concord Ave. North of College St.,2021-06-21,2021-10-27 00:00:00,-,-,-,-,-,-,-,-,-,-,-,-,103,208,134,144,-,-,-,-,-,-,-,-,-,-,-,-,-,-
A119,Dundas St. W. Near Carlyle St.,2021-08-04,2021-10-26 00:00:00,-,-,-,-,-,-,-,-,-,-,-,-,-,141,614,1427,-,-,-,-,-,-,-,-,-,-,-,-,-,-
A120,The Esplanade East of Princess St.,2021-06-24,2021-10-18 00:00:00,-,-,-,-,-,-,-,-,-,-,-,3,35,50,50,14,-,-,-,-,-,-,-,-,-,-,-,-,-,-
A121,Avenue Rd. Near Macpherson Ave,2021-07-09,2021-10-21 00:00:00,-,-,-,-,-,-,-,-,-,-,-,-,244,298,622,265,-,-,-,-,-,-,-,-,-,-,-,-,-,-
A122,Clinton St North of College St.,2021-06-21,2021-10-20 00:00:00,-,-,-,-,-,-,-,-,-,-,-,90,64,232,232,279,-,-,-,-,-,-,-,-,-,-,-,-,-,-
A123,Davisville Ave. Near Acacia Rd.,2021-06-18,2021-10-19 00:00:00,-,-,-,-,-,-,-,-,-,-,-,1317,1162,954,698,1084,-,-,-,-,-,-,-,-,-,-,-,-,-,-
A124,Bansley Ave South of Vaughan Rd,2021-06-21,2021-10-20 00:00:00,-,-,-,-,-,-,-,-,-,-,-,-,-,1,2,-,-,-,-,-,-,-,-,-,-,-,-,-,-,-
A125,Homewood Ave. Near Maitland Place,2021-07-05,2021-10-19 00:00:00,-,-,-,-,-,-,-,-,-,-,-,-,26,33,19,11,-,-,-,-,-,-,-,-,-,-,-,-,-,-
A126,Parliament St. North of Oak St.,2021-06-17,2021-10-22 00:00:00,-,-,-,-,-,-,-,-,-,-,-,415,788,823,760,371,-,-,-,-,-,-,-,-,-,-,-,-,-,-
A127,Greenwood Ave. South of Glebeholme Blvd.,2021-06-04,2021-10-07 00:00:00,-,-,-,-,-,-,-,-,-,-,-,3729,2127,2673,1581,653,-,-,-,-,-,-,-,-,-,-,-,-,-,-
A128,Plains Rd. Near Milton Rd.,2021-06-24,2021-10-07 00:00:00,-,-,-,-,-,-,-,-,-,-,-,189,410,250,386,118,-,-,-,-,-,-,-,-,-,-,-,-,-,-
A129,Blythwood Rd. Near Blyth Dale Rd.,2021-05-21,2021-10-08 00:00:00,-,-,-,-,-,-,-,-,-,-,190,237,498,253,244,27,-,-,-,-,-,-,-,-,-,-,-,-,-,-
A130,Leslie St. Southbond South of Lawrence Ave. E.,2021-05-20,2021-10-08 00:00:00,-,-,-,-,-,-,-,-,-,-,441,2507,665,1153,1185,440,-,-,-,-,-,-,-,-,-,-,-,-,-,-
A131,York Mills Rd. East of Rayoak Dr.,2021-05-21,2021-10-08 00:00:00,-,-,-,-,-,-,-,-,-,-,113,189,195,74,139,52,-,-,-,-,-,-,-,-,-,-,-,-,-,-
A132,Grenoble Dr. West of Spanbridge Rd.,2021-06-08,2021-10-08 00:00:00,-,-,-,-,-,-,-,-,-,-,-,168,161,213,122,42,-,-,-,-,-,-,-,-,-,-,-,-,-,-
A133,Van Horne Ave. West of Brian Dr.,2021-06-02,2021-10-13 00:00:00,-,-,-,-,-,-,-,-,-,-,-,196,111,151,160,64,-,-,-,-,-,-,-,-,-,-,-,-,-,-
A134,Parkway Forest Dr. Near 25 Parkway Forest Dr.,2021-06-08,2021-10-14 00:00:00,-,-,-,-,-,-,-,-,-,-,-,92,147,151,115,72,-,-,-,-,-,-,-,-,-,-,-,-,-,-
A135,Drewry Ave. East of Norwin St.,2021-06-09,2021-10-12 00:00:00,-,-,-,-,-,-,-,-,-,-,-,883,575,816,176,144,-,-,-,-,-,-,-,-,-,-,-,-,-,-
A136,Ellerslie Ave. Near Diagonal Rd.,2021-06-08,2021-10-14 00:00:00,-,-,-,-,-,-,-,-,-,-,-,21,21,18,10,0,-,-,-,-,-,-,-,-,-,-,-,-,-,-
A137,Victoria Park Ave. Near Tiago Ave.,2021-06-24,2021-10-22 00:00:00,-,-,-,-,-,-,-,-,-,-,-,840,2645,2309,2664,2640,-,-,-,-,-,-,-,-,-,-,-,-,-,-
A138,Secord Ave. Near Palmer Ave.,2021-06-18,2021-10-22 00:00:00,-,-,-,-,-,-,-,-,-,-,-,18,548,499,482,203,-,-,-,-,-,-,-,-,-,-,-,-,-,-
A139,Birchmount Rd. South of Sadler Dr.,2021-06-16,2021-10-12 00:00:00,-,-,-,-,-,-,-,-,-,-,-,152,244,330,109,126,-,-,-,-,-,-,-,-,-,-,-,-,-,-
A140,Bellamy Rd. S. North of Kingston Rd.,2021-06-21,2021-10-12 00:00:00,-,-,-,-,-,-,-,-,-,-,-,5,239,309,325,157,-,-,-,-,-,-,-,-,-,-,-,-,-,-
A141,Gilder Dr. East of Midland Ave.,2021-06-24,2021-10-12 00:00:00,-,-,-,-,-,-,-,-,-,-,-,1,244,114,56,34,-,-,-,-,-,-,-,-,-,-,-,-,-,-
A142,Lawrence Ave. E. West of Ben Stanton Blvd.,2021-07-07,2021-10-12 00:00:00,-,-,-,-,-,-,-,-,-,-,-,-,1289,316,451,423,-,-,-,-,-,-,-,-,-,-,-,-,-,-
A143,Bamburgh Circle Near 125 Bamburgh Circle,2021-05-20,2021-10-13 00:00:00,-,-,-,-,-,-,-,-,-,-,593,1172,220,110,422,183,-,-,-,-,-,-,-,-,-,-,-,-,-,-
A144,Chester Le Blvd. Near Pettibone Square,2021-05-20,2021-10-13 00:00:00,-,-,-,-,-,-,-,-,-,-,17,42,28,24,3,5,-,-,-,-,-,-,-,-,-,-,-,-,-,-
A145,Huntingwood Dr. Near Mollard Rd.,2021-06-04,2021-10-20 00:00:00,-,-,-,-,-,-,-,-,-,-,-,249,164,195,94,122,-,-,-,-,-,-,-,-,-,-,-,-,-,-
A146,Heather Rd. East of Glen Watford Dr.,2021-06-09,2021-10-20 00:00:00,-,-,-,-,-,-,-,-,-,-,-,187,121,145,114,93,-,-,-,-,-,-,-,-,-,-,-,-,-,-
A147,Military Trail Near 341 Military Trail,2021-06-18,2021-10-27 00:00:00,-,-,-,-,-,-,-,-,-,-,-,967,233,424,684,551,-,-,-,-,-,-,-,-,-,-,-,-,-,-
A148,Gatesview Ave. East of Cedar Dr.,2021-06-09,2021-10-27 00:00:00,-,-,-,-,-,-,-,-,-,-,-,16,32,42,13,17,-,-,-,-,-,-,-,-,-,-,-,-,-,-
A149,Sewells Rd. West of Glenheather Terrace,2021-06-08,2021-10-20 00:00:00,-,-,-,-,-,-,-,-,-,-,-,135,167,66,278,253,-,-,-,-,-,-,-,-,-,-,-,-,-,-
A150,Centennial Rd. South of Cherrydale Court,2021-05-28,2021-10-18 00:00:00,-,-,-,-,-,-,-,-,-,-,63,474,42,162,245,76,-,-,-,-,-,-,-,-,-,-,-,-,-,-
A020,Givins St. South of Argyle St.,2021-11-22,2022-04-11 00:00:00,-,-,-,-,-,-,-,-,-,-,-,-,-,-,-,-,52,83,14,14,62,28,,,,,,-,-,-
A151,Kipling Ave. South of Snaresbrook Dr.,2021-11-03,2022-03-28 00:00:00,-,-,-,-,-,-,-,-,-,-,-,-,-,-,-,-,1685,884,721,463,475,-,-,-,-,-,-,-,-,-
A152,Silverstone Dr. North of Avening Dr.,2021-11-03,2022-03-28 00:00:00,-,-,-,-,-,-,-,-,-,-,-,-,-,-,-,-,447,344,77,67,236,-,-,-,-,-,-,-,-,-
A153,The Westway West of Brampton Rd.,2021-11-04,2022-03-28 00:00:00,-,-,-,-,-,-,-,-,-,-,-,-,-,-,-,-,624,693,147,279,376,-,-,-,-,-,-,-,-,-
A154,Montgomery Rd. Near Loyalist Rd.,2021-11-20,2022-03-28 00:00:00,-,-,-,-,-,-,-,-,-,-,-,-,-,-,-,-,90,211,112,110,263,-,-,-,-,-,-,-,-,-
A155,Birmingham St. West of Kipling Ave.,2021-11-29,2022-04-04 00:00:00,-,-,-,-,-,-,-,-,-,-,-,-,-,-,-,-,2,312,420,227,552,36,-,-,-,-,-,-,-,-
A156,Royal York Rd. North of Coney Rd.,2021-11-15,2022-04-04 00:00:00,-,-,-,-,-,-,-,-,-,-,-,-,-,-,-,-,1370,2724,1704,1624,1161,139,-,-,-,-,-,-,-,-
A157,Priscilla Ave. South of Dundas St. W. ,2021-11-16,2022-04-04 00:00:00,-,-,-,-,-,-,-,-,-,-,-,-,-,-,-,-,491,284,63,203,284,-,-,-,-,-,-,-,-,-
A158,Jane St. South of Weatherell St.,2021-12-10,2022-04-04 00:00:00,-,-,-,-,-,-,-,-,-,-,-,-,-,-,-,-,-,515,616,737,305,-,-,-,-,-,-,-,-,-
A159,Lawrence Ave. W. East of Martini Dr. ,2021-12-09,2022-03-28 00:00:00,-,-,-,-,-,-,-,-,-,-,-,-,-,-,-,-,-,1518,797,498,10,-,-,-,-,-,-,-,-,-
A160,King St. South of George St.,2021-12-09,2022-03-28 00:00:00,-,-,-,-,-,-,-,-,-,-,-,-,-,-,-,-,-,508,431,281,535,-,-,-,-,-,-,-,-,-
A161,Sheppard Ave. W. East of Buckland Rd.,2021-11-03,2022-04-25 00:00:00,-,-,-,-,-,-,-,-,-,-,-,-,-,-,-,-,1542,929,436,711,862,679,-,-,-,-,-,-,-,-
A162,Faywood Blvd. Near Norcross Rd.,2021-11-30,2022-04-25 00:00:00,-,-,-,-,-,-,-,-,-,-,-,-,-,-,-,-,0,107,145,173,438,410,-,-,-,-,-,-,-,-
A163,Jane St. North of Clair Rd.,2021-11-24,2022-03-28 00:00:00,-,-,-,-,-,-,-,-,-,-,-,-,-,-,-,-,188,1005,591,715,734,-,-,-,-,-,-,-,-,-
A164,Yorkwoods Gate East of Jane St.,2021-11-25,2022-03-28 00:00:00,-,-,-,-,-,-,-,-,-,-,-,-,-,-,-,-,72,237,259,126,98,-,-,-,-,-,-,-,-,-
A165,Glenmount Ave. Near Madoc Dr.,2021-11-26,2022-04-25 00:00:00,-,-,-,-,-,-,-,-,-,-,-,-,-,-,-,-,118,771,253,171,362,254,-,-,-,-,-,-,-,-
A166,Avenue Rd. South of Caribou Rd.,2021-12-06,2022-04-25 00:00:00,-,-,-,-,-,-,-,-,-,-,-,-,-,-,-,-,-,889,2188,2147,2826,2179,-,-,-,-,-,-,-,-
A167,Dufferin St. North of Norton Ave.,2021-12-06,2022-04-04 00:00:00,-,-,-,-,-,-,-,-,-,-,-,-,-,-,-,-,-,565,759,246,629,142,-,-,-,-,-,-,-,-
A168,Oakwood Ave. Near Biggar Ave.,2021-11-25,2022-04-04 00:00:00,-,-,-,-,-,-,-,-,-,-,-,-,-,-,-,-,101,454,420,338,340,52,-,-,-,-,-,-,-,-
A169,Queens Quay East of Bathurst St.,2021-11-16,2022-04-11 00:00:00,-,-,-,-,-,-,-,-,-,-,-,-,-,-,-,-,303,417,101,174,165,72,-,-,-,-,-,-,-,-
A170,Davenport Rd. Near Bishop St.,2021-12-09,2022-04-04 00:00:00,-,-,-,-,-,-,-,-,-,-,-,-,-,-,-,-,-,858,891,668,464,45,-,-,-,-,-,-,-,-
A171,Beverley St. Near D'Arcy St.,2021-12-29,2022-04-04 00:00:00,-,-,-,-,-,-,-,-,-,-,-,-,-,-,-,-,-,-,2772,4952,2263,572,-,-,-,-,-,-,-,-
A172,Bathurst St. Near Ardmore Rd. ,2022-01-20,2022-04-25 00:00:00,-,-,-,-,-,-,-,-,-,-,-,-,-,-,-,-,-,-,36,2798,1802,1961,-,-,-,-,-,-,-,-
A173,Arlington Ave. South of Durham Ave.,2021-12-03,2022-05-16 00:00:00,-,-,-,-,-,-,-,-,-,-,-,-,-,-,-,-,-,264,194,214,377,203,70,-,-,-,-,-,-,-
A174,Queen St. E. Near Sackville St.,2021-12-17,2022-04-11 00:00:00,-,-,-,-,-,-,-,-,-,-,-,-,-,-,-,-,-,298,529,517,648,362,-,-,-,-,-,-,-,-
A175,Isabella St. West of Sherbourne St.,2021-12-01,2022-04-11 00:00:00,-,-,-,-,-,-,-,-,-,-,-,-,-,-,-,-,-,1727,675,712,1324,466,-,-,-,-,-,-,-,-
A176,Donlands Ave. Near Memorial Park Ave.,2021-12-16,2022-05-09 00:00:00,-,-,-,-,-,-,-,-,-,-,-,-,-,-,-,-,-,213,137,276,403,158,14,-,-,-,-,-,-,-
A177,Westwood Ave. West of Carlaw Ave.,2021-11-23,2022-05-09 00:00:00,-,-,-,-,-,-,-,-,-,-,-,-,-,-,-,-,161,505,184,139,349,164,11,-,-,-,-,-,-,-
A178,Lawrence Ave. E. East of Mildenhall Rd.,2021-12-01,2022-05-09 00:00:00,-,-,-,-,-,-,-,-,-,-,-,-,-,-,-,-,-,619,327,418,296,263,30,-,-,-,-,-,-,-
A179,Banbury Rd. Near Portsmith Rd.,2021-11-12,2022-05-09 00:00:00,-,-,-,-,-,-,-,-,-,-,-,-,-,-,-,-,825,845,338,188,92,63,14,-,-,-,-,-,-,-
